{
  "schema_version": "1.3",
  "event_id": "709bf968-60d3-4fee-87a6-b98753833ab0",
  "event_type": "certificate.issued",
  "observed_at": "2026-10-11T09:05:00Z",
  "source": {"type": "fixture", "id": "local-demo"},
  "certificate": {
    "fingerprint_sha256": "abcdef0123456789abcdef0123456789abcdef0123456789abcdef0123456789",
    "serial_number": "02BC34DE",
    "subject": "CN=api.example.com",
    "issuer": "CN=Example Test Issuer",
    "san_dns_names": ["api.example.com", "*.service.example.com"],
    "not_before": "2026-10-11T09:00:00Z",
    "not_after": "2027-01-09T09:00:00Z"
  },
  "cryptography": {
    "public_key": {"family": "rsa", "name": "RSA", "oid": "1.2.840.113549.1.1.1", "key_size_bits": 2048},
    "certificate_signature": {"family": "rsa", "name": "sha256WithRSAEncryption", "oid": "1.2.840.113549.1.1.11", "hash_algorithm": "SHA-256"},
    "key_usage": ["digital-signature", "key-encipherment"],
    "extended_key_usage": ["server-authentication"]
  },
  "context": {
    "environment": "production",
    "asset_id": "asset-web-api-001",
    "service_id": "service-customer-api",
    "owner": "platform-security",
    "business_criticality": "high",
    "data_classification": "confidential",
    "protection_lifetime_months": 84
  },
  "evidence": {
    "observed_by": "fixture-generator",
    "collected_at": "2026-10-11T09:05:01Z"
  },
  "provenance": {
    "collector_id": "fixture-generator",
    "collector_version": "0.2.0",
    "source_record_id": "fixture:known-domain-issued",
    "payload_sha256": "1111111111111111111111111111111111111111111111111111111111111111",
    "verification_state": "unverified",
    "evidence_level": "simulated",
    "cursor": "fixture-2"
  }
}
